סוג קוד,תיאור הבחנה,קוד הבחנה,תאריך ביקור,תעודת זהות
298484944,2011-12-09 09:26:31,S36259A,"Moderate laceration of unspecified part of pancreas, initial encounter",icd10
206419143,1995-04-04 17:37:44,S65312D,"Laceration of deep palmar arch of left hand, subsequent encounter",icd10
371533987,1995-06-01 05:16:07,A5206,Other syphilitic heart involvement,icd10
343412582,1998-09-18 02:06:41,S15312S,"Minor laceration of left internal jugular vein, sequela",icd10
222637585,2018-03-07 16:05:21,S82856C,"Nondisplaced trimalleolar fracture of unspecified lower leg, initial encounter for open fracture type IIIA, IIIB, or IIIC",icd10
227651481,1971-06-20 12:19:54,T444X4D,"Poisoning by predominantly alpha-adrenoreceptor agonists, undetermined, subsequent encounter",icd10
228673469,2002-02-03 21:20:56,M205X2,"Other deformities of toe(s) (acquired), left foot",icd10
252856463,1983-12-18 17:03:45,A981,Omsk hemorrhagic fever,icd10
316186497,1989-07-22 20:09:17,S49192A,"Other physeal fracture of lower end of humerus, left arm, initial encounter for closed fracture",icd10
288771538,2020-01-14 22:24:19,M89029,"Algoneurodystrophy, unspecified upper arm",icd10
349698351,1994-12-19 07:41:15,V569XXS,"Unspecified occupant of pick-up truck or van injured in collision with other nonmotor vehicle in traffic accident, sequela",icd10
319401261,1971-01-04 14:00:13,T84196S,"Other mechanical complication of internal fixation device of bone of right lower leg, sequela",icd10
280331002,1992-06-05 22:33:56,S63635A,"Sprain of interphalangeal joint of left ring finger, initial encounter",icd10
301115548,2004-02-25 07:12:48,H18441,"Keratomalacia, right eye",icd10
247579444,1992-04-01 08:30:27,S56118A,"Strain of flexor muscle, fascia and tendon of left little finger at forearm level, initial encounter",icd10
225886408,1975-09-08 19:22:47,M62569,"Muscle wasting and atrophy, not elsewhere classified, unspecified lower leg",icd10
235515460,2017-10-10 10:26:44,R5081,Fever presenting with conditions classified elsewhere,icd10
326993544,2003-08-19 01:51:19,Q2541,Absence and aplasia of aorta,icd10
210588234,2016-04-03 14:47:06,S85139A,"Unspecified injury of anterior tibial artery, unspecified leg, initial encounter",icd10
320040161,1975-01-16 04:57:39,T2170XA,"Corrosion of third degree of trunk, unspecified site, initial encounter",icd10
384364328,2004-07-16 19:56:38,S75091D,"Other specified injury of femoral artery, right leg, subsequent encounter",icd10
201265074,1989-09-09 06:55:16,Z9689,Presence of other specified functional implants,icd10
354223569,2018-08-07 10:18:59,G44229,"Chronic tension-type headache, not intractable",icd10
210435290,2004-10-24 21:19:36,S32445A,"Nondisplaced fracture of posterior column [ilioischial] of left acetabulum, initial encounter for closed fracture",icd10
271759842,2007-08-19 16:58:16,T3693XS,"Poisoning by unspecified systemic antibiotic, assault, sequela",icd10
364224290,2005-10-26 00:36:05,M10341,"Gout due to renal impairment, right hand",icd10
251158837,1971-11-03 21:27:58,H30013,"Focal chorioretinal inflammation, juxtapapillary, bilateral",icd10
348413299,1993-12-17 19:05:47,D298,Benign neoplasm of other specified male genital organs,icd10
226683161,1994-10-06 23:01:39,T699XXD,"Effect of reduced temperature, unspecified, subsequent encounter",icd10
356298152,1998-01-13 17:26:11,M880,Osteitis deformans of skull,icd10
364419991,2005-12-24 11:00:39,T4794XS,"Poisoning by unspecified agents primarily affecting the gastrointestinal system, undetermined, sequela",icd10
268580721,1983-03-23 04:10:37,S72456E,"Nondisplaced supracondylar fracture without intracondylar extension of lower end of unspecified femur, subsequent encounter for open fracture type I or II with routine healing",icd10
221759392,1987-05-03 18:13:01,M21339,"Wrist drop, unspecified wrist",icd10
245012019,1981-07-07 14:23:54,S0219XG,"Other fracture of base of skull, subsequent encounter for fracture with delayed healing",icd10
326389365,1995-12-26 01:28:15,P789,"Perinatal digestive system disorder, unspecified",icd10
276256731,1988-10-15 14:07:46,T22239S,"Burn of second degree of unspecified upper arm, sequela",icd10
260221338,1991-02-26 15:48:05,T63463S,"Toxic effect of venom of wasps, assault, sequela",icd10
246935895,1985-02-24 10:51:50,S45311A,"Laceration of superficial vein at shoulder and upper arm level, right arm, initial encounter",icd10
202485922,1990-09-16 08:44:18,I369,"Nonrheumatic tricuspid valve disorder, unspecified",icd10
260396064,1995-03-27 20:39:23,M25073,"Hemarthrosis, unspecified ankle",icd10
235370753,1983-08-23 02:35:19,S76021A,"Laceration of muscle, fascia and tendon of right hip, initial encounter",icd10
322211259,2007-10-11 04:06:28,W101XXD,"Fall (on)(from) sidewalk curb, subsequent encounter",icd10
266252544,2017-02-25 13:54:22,V7960XA,"Unspecified bus occupant injured in collision with unspecified motor vehicles in traffic accident, initial encounter",icd10
349971779,2007-07-07 07:09:25,S52244M,"Nondisplaced spiral fracture of shaft of ulna, right arm, subsequent encounter for open fracture type I or II with nonunion",icd10
286448610,1996-04-22 01:38:29,S72452A,"Displaced supracondylar fracture without intracondylar extension of lower end of left femur, initial encounter for closed fracture",icd10
318516276,1979-03-08 17:48:23,S3130XD,"Unspecified open wound of scrotum and testes, subsequent encounter",icd10
276669162,2004-07-17 15:47:56,S90811A,"Abrasion, right foot, initial encounter",icd10
380541121,1978-10-22 21:09:34,S080XXD,"Avulsion of scalp, subsequent encounter",icd10
344400062,1985-10-22 03:07:49,S52201S,"Unspecified fracture of shaft of right ulna, sequela",icd10
215771240,1997-08-23 19:54:04,W5542XS,"Struck by pig, sequela",icd10
291797309,1988-09-20 07:04:00,M84443D,"Pathological fracture, unspecified hand, subsequent encounter for fracture with routine healing",icd10
302821750,1993-09-30 18:34:27,D067,Carcinoma in situ of other parts of cervix,icd10
227679174,2010-01-31 02:37:25,H7202,"Central perforation of tympanic membrane, left ear",icd10
350855716,1978-03-14 23:54:29,M488X2,"Other specified spondylopathies, cervical region",icd10
306467810,2003-04-18 10:58:39,T44991D,"Poisoning by other drug primarily affecting the autonomic nervous system, accidental (unintentional), subsequent encounter",icd10
277806959,1976-08-18 11:06:04,S92314B,"Nondisplaced fracture of first metatarsal bone, right foot, initial encounter for open fracture",icd10
331549018,2003-05-11 22:28:11,T505X4S,"Poisoning by appetite depressants, undetermined, sequela",icd10
388913223,2018-09-28 21:11:14,S93312D,"Subluxation of tarsal joint of left foot, subsequent encounter",icd10
276498006,1985-08-17 21:28:08,S2096XA,"Insect bite (nonvenomous) of unspecified parts of thorax, initial encounter",icd10
273071379,1987-12-16 20:51:58,G218,Other secondary parkinsonism,icd10
377633639,1992-12-18 20:24:47,C44601,"Unspecified malignant neoplasm of skin of unspecified upper limb, including shoulder",icd10
216944616,1996-06-05 12:06:51,S72063A,"Displaced articular fracture of head of unspecified femur, initial encounter for closed fracture",icd10
275637238,1983-05-17 02:07:57,M89479,"Other hypertrophic osteoarthropathy, unspecified ankle and foot",icd10
308573932,1981-12-18 12:23:33,W3081XS,"Contact with agricultural transport vehicle in stationary use, sequela",icd10
222020810,1979-10-10 06:40:13,D049,"Carcinoma in situ of skin, unspecified",icd10
336147111,2010-05-02 01:18:18,L97329,Non-pressure chronic ulcer of left ankle with unspecified severity,icd10
293717210,2008-09-15 15:33:37,S42413A,"Displaced simple supracondylar fracture without intercondylar fracture of unspecified humerus, initial encounter for closed fracture",icd10
379279728,2012-11-02 02:21:25,V9505XA,"Helicopter explosion injuring occupant, initial encounter",icd10
376441875,1974-03-29 16:50:46,S82023D,"Displaced longitudinal fracture of unspecified patella, subsequent encounter for closed fracture with routine healing",icd10
376966677,1977-12-03 14:35:03,T2112XD,"Burn of first degree of abdominal wall, subsequent encounter",icd10
281366559,2000-02-23 20:58:54,M76812,"Anterior tibial syndrome, left leg",icd10
276866595,1984-12-15 11:23:43,S63102D,"Unspecified subluxation of left thumb, subsequent encounter",icd10
370336928,1983-10-20 22:24:21,S11025A,"Open bite of trachea, initial encounter",icd10
321659367,1981-12-23 10:30:11,V9615XA,"Hang-glider explosion injuring occupant, initial encounter",icd10
295627498,1993-05-25 02:29:10,B955,Unspecified streptococcus as the cause of diseases classified elsewhere,icd10
374351143,1971-10-23 06:09:10,S76891A,"Other injury of other specified muscles, fascia and tendons at thigh level, right thigh, initial encounter",icd10
201820701,2001-04-11 00:02:58,I676,Nonpyogenic thrombosis of intracranial venous system,icd10
239974185,2016-02-26 04:03:16,S82015M,"Nondisplaced osteochondral fracture of left patella, subsequent encounter for open fracture type I or II with nonunion",icd10
367024805,1999-12-12 22:36:45,M84676S,"Pathological fracture in other disease, unspecified foot, sequela",icd10
377259182,1980-12-29 08:25:24,S8253XD,"Displaced fracture of medial malleolus of unspecified tibia, subsequent encounter for closed fracture with routine healing",icd10
244312930,2015-05-05 03:08:54,D613,Idiopathic aplastic anemia,icd10
318359893,1976-08-30 02:13:24,T63822A,"Toxic effect of contact with venomous toad, intentional self-harm, initial encounter",icd10
299378984,1974-01-08 11:56:35,S90522A,"Blister (nonthermal), left ankle, initial encounter",icd10
377763783,1996-03-07 04:09:33,V4919XS,"Passenger injured in collision with other motor vehicles in nontraffic accident, sequela",icd10
348470354,2017-03-08 12:57:14,E869,"Volume depletion, unspecified",icd10
296742737,1984-04-02 18:45:28,S8421XA,"Injury of cutaneous sensory nerve at lower leg level, right leg, initial encounter",icd10
348654276,1992-09-02 00:49:41,T45615A,"Adverse effect of thrombolytic drugs, initial encounter",icd10
313016261,2008-05-27 01:48:16,S098XXS,"Other specified injuries of head, sequela",icd10
211187887,1983-05-06 23:15:48,S65101S,"Unspecified injury of radial artery at wrist and hand level of right arm, sequela",icd10
382868178,1976-09-02 22:48:58,T25432S,"Corrosion of unspecified degree of left toe(s) (nail), sequela",icd10
209162502,2002-09-15 13:16:35,S80849S,"External constriction, unspecified lower leg, sequela",icd10
267920094,2018-07-14 23:44:50,J983,Compensatory emphysema,icd10
251725452,1982-09-09 10:22:53,M20092,Other deformity of left finger(s),icd10
358103574,1992-09-21 10:22:45,O368224,"Fetal anemia and thrombocytopenia, second trimester, fetus 4",icd10
259993093,1991-07-20 05:52:33,M84350K,"Stress fracture, pelvis, subsequent encounter for fracture with nonunion",icd10
304755369,1985-10-01 22:22:29,S93303D,"Unspecified subluxation of unspecified foot, subsequent encounter",icd10
249258266,1972-10-02 03:04:02,S63294D,"Dislocation of distal interphalangeal joint of right ring finger, subsequent encounter",icd10
287105848,1975-02-18 19:40:40,S82002N,"Unspecified fracture of left patella, subsequent encounter for open fracture type IIIA, IIIB, or IIIC with nonunion",icd10
323777908,2018-04-03 11:38:15,I424,Endocardial fibroelastosis,icd10
368236829,1982-04-21 00:40:14,H1840,Unspecified corneal degeneration,icd10
256049532,1991-12-01 00:01:15,S71141D,"Puncture wound with foreign body, right thigh, subsequent encounter",icd10
305547998,1989-07-30 10:56:31,S92525G,"Nondisplaced fracture of middle phalanx of left lesser toe(s), subsequent encounter for fracture with delayed healing",icd10
229204169,2000-03-12 00:38:24,I824Z2,Acute embolism and thrombosis of unspecified deep veins of left distal lower extremity,icd10
206207532,1982-10-14 04:47:16,V8656XD,"Driver of dirt bike or motor/cross bike injured in nontraffic accident, subsequent encounter",icd10
328926108,1984-01-23 16:12:10,S53006D,"Unspecified dislocation of unspecified radial head, subsequent encounter",icd10
302874377,2016-07-28 07:10:14,K002,Abnormalities of size and form of teeth,icd10
204930118,1975-10-15 18:29:31,S99249B,"Salter-Harris Type IV physeal fracture of phalanx of unspecified toe, initial encounter for open fracture",icd10
204388245,1981-08-04 15:48:24,S92811B,"Other fracture of right foot, initial encounter for open fracture",icd10
341520560,1995-11-22 00:42:08,H7202,"Central perforation of tympanic membrane, left ear",icd10
251621248,1999-07-27 15:21:55,S63309D,"Traumatic rupture of unspecified ligament of unspecified wrist, subsequent encounter",icd10
318160644,1984-03-02 16:33:17,Q289,"Congenital malformation of circulatory system, unspecified",icd10
270987957,2016-04-08 17:35:53,E614,Chromium deficiency,icd10
238773847,1989-03-29 16:47:30,S82435F,"Nondisplaced oblique fracture of shaft of left fibula, subsequent encounter for open fracture type IIIA, IIIB, or IIIC with routine healing",icd10
276906481,1971-08-29 03:59:29,M84454P,"Pathological fracture, pelvis, subsequent encounter for fracture with malunion",icd10
200668218,2011-09-11 05:34:00,M25771,"Osteophyte, right ankle",icd10
308175699,1998-05-09 07:32:20,S61223D,"Laceration with foreign body of left middle finger without damage to nail, subsequent encounter",icd10
214959118,1986-04-27 08:54:07,S83143A,"Lateral subluxation of proximal end of tibia, unspecified knee, initial encounter",icd10
274523689,1984-01-21 13:59:11,S46891D,"Other injury of other muscles, fascia and tendons at shoulder and upper arm level, right arm, subsequent encounter",icd10
371932836,1980-03-24 19:20:45,O98411,"Viral hepatitis complicating pregnancy, first trimester",icd10
356943178,1982-01-12 03:43:50,S82426K,"Nondisplaced transverse fracture of shaft of unspecified fibula, subsequent encounter for closed fracture with nonunion",icd10
358879678,2009-04-14 02:43:45,T3299,Corrosions involving 90% or more of body surface with 90% or more third degree corrosion,icd10
355490083,1998-08-07 21:38:17,M06311,"Rheumatoid nodule, right shoulder",icd10
374550120,2002-06-09 18:02:43,P0710,"Other low birth weight newborn, unspecified weight",icd10
361016455,1987-07-11 18:38:10,V9339XS,"Fall on board unspecified watercraft, sequela",icd10
296873416,2016-11-13 20:05:29,S72144A,"Nondisplaced intertrochanteric fracture of right femur, initial encounter for closed fracture",icd10
268544606,1987-12-01 06:40:54,T38996D,"Underdosing of other hormone antagonists, subsequent encounter",icd10
360309915,1988-04-21 17:34:16,T83098S,"Other mechanical complication of other urinary catheter, sequela",icd10
374641852,1990-04-12 05:43:51,H1131,"Conjunctival hemorrhage, right eye",icd10
315384636,2020-03-06 07:42:56,M6018,"Interstitial myositis, other site",icd10
352216863,1973-05-13 21:42:22,V8651XS,"Driver of ambulance or fire engine injured in nontraffic accident, sequela",icd10
339795516,1972-10-16 20:03:09,C060,Malignant neoplasm of cheek mucosa,icd10
387505592,1974-06-11 11:11:28,M88819,Osteitis deformans of unspecified shoulder,icd10
256160516,2000-07-14 00:41:55,S76911S,"Strain of unspecified muscles, fascia and tendons at thigh level, right thigh, sequela",icd10
236773007,2006-05-01 06:26:45,S53412S,"Radiohumeral (joint) sprain of left elbow, sequela",icd10
282943967,1999-06-09 04:45:25,Y36590A,"War operation involving other effects of nuclear weapons, military personnel, initial encounter",icd10
353851516,2018-09-01 17:02:10,S52399M,"Other fracture of shaft of radius, unspecified arm, subsequent encounter for open fracture type I or II with nonunion",icd10
326048282,1998-06-18 09:41:25,T386X2A,"Poisoning by antigonadotrophins, antiestrogens, antiandrogens, not elsewhere classified, intentional self-harm, initial encounter",icd10
304538731,1997-02-11 23:47:36,S72454F,"Nondisplaced supracondylar fracture without intracondylar extension of lower end of right femur, subsequent encounter for open fracture type IIIA, IIIB, or IIIC with routine healing",icd10
206606763,1976-02-19 15:14:38,M00161,"Pneumococcal arthritis, right knee",icd10
274779417,2004-03-15 07:30:43,J09X3,Influenza due to identified novel influenza A virus with gastrointestinal manifestations,icd10
273929858,1980-11-21 14:53:34,M315,Giant cell arteritis with polymyalgia rheumatica,icd10
273344538,2008-10-25 16:13:20,O9A13,Malignant neoplasm complicating the puerperium,icd10
205410973,1990-10-19 22:53:04,T8642,Liver transplant failure,icd10
250802936,1973-09-04 03:13:33,S92056A,"Nondisplaced other extraarticular fracture of unspecified calcaneus, initial encounter for closed fracture",icd10
318983057,1981-07-12 09:39:09,G7119,Other specified myotonic disorders,icd10
338167713,1994-08-20 04:29:54,Z6830,"Body mass index (BMI) 30.0-30.9, adult",icd10
293358549,1976-06-15 22:23:17,S72064S,"Nondisplaced articular fracture of head of right femur, sequela",icd10
370418922,2004-10-25 04:44:59,K9049,"Malabsorption due to intolerance, not elsewhere classified",icd10
279045037,1976-05-27 22:06:49,S72344H,"Nondisplaced spiral fracture of shaft of right femur, subsequent encounter for open fracture type I or II with delayed healing",icd10
216468560,2000-12-18 13:49:24,S82153E,"Displaced fracture of unspecified tibial tuberosity, subsequent encounter for open fracture type I or II with routine healing",icd10
381633982,1979-09-18 14:37:15,S62657G,"Nondisplaced fracture of medial phalanx of left little finger, subsequent encounter for fracture with delayed healing",icd10
305594897,1993-01-27 06:25:21,J95860,Postprocedural hematoma of a respiratory system organ or structure following a respiratory system procedure,icd10
308442981,1989-09-10 18:01:53,S63123A,"Subluxation of interphalangeal joint of unspecified thumb, initial encounter",icd10
338906136,1975-09-03 03:20:41,M06272,"Rheumatoid bursitis, left ankle and foot",icd10
261367146,2000-03-04 13:29:38,T563X2A,"Toxic effect of cadmium and its compounds, intentional self-harm, initial encounter",icd10
219226184,2008-01-22 23:35:37,S41151D,"Open bite of right upper arm, subsequent encounter",icd10
270611304,1986-09-05 13:29:40,T63822A,"Toxic effect of contact with venomous toad, intentional self-harm, initial encounter",icd10
383939688,1998-04-21 19:41:21,K709,"Alcoholic liver disease, unspecified",icd10
232731535,1984-06-04 18:47:48,S8255XR,"Nondisplaced fracture of medial malleolus of left tibia, subsequent encounter for open fracture type IIIA, IIIB, or IIIC with malunion",icd10
315759538,1979-10-25 20:44:27,H5212,"Myopia, left eye",icd10
256867289,1996-07-25 11:37:51,C8598,"Non-Hodgkin lymphoma, unspecified, lymph nodes of multiple sites",icd10
235808241,1996-07-27 04:21:40,M3393,"Dermatopolymyositis, unspecified without myopathy",icd10
308745369,2008-01-21 19:08:36,J0121,Acute recurrent ethmoidal sinusitis,icd10
292600616,1996-11-15 13:40:54,O24319,"Unspecified pre-existing diabetes mellitus in pregnancy, unspecified trimester",icd10
365268279,2007-01-13 09:56:17,O321XX2,"Maternal care for breech presentation, fetus 2",icd10
294589647,1980-08-26 16:29:48,T25622D,"Corrosion of second degree of left foot, subsequent encounter",icd10
374984656,2002-05-16 01:18:43,H401214,"Low-tension glaucoma, right eye, indeterminate stage",icd10
342064189,2015-08-13 02:14:11,S21351S,"Open bite of right front wall of thorax with penetration into thoracic cavity, sequela",icd10
257248124,1997-05-07 02:11:05,V9207XS,"Drowning and submersion due to fall off water-skis, sequela",icd10
365699017,2018-10-25 11:34:59,X788XXS,"Intentional self-harm by other sharp object, sequela",icd10
274036833,2020-03-26 09:02:59,Z046,"Encounter for general psychiatric examination, requested by authority",icd10
336476434,1990-11-11 13:58:43,S0570XA,"Avulsion of unspecified eye, initial encounter",icd10
375296886,1971-10-29 07:54:23,S62243S,"Displaced fracture of shaft of first metacarpal bone, unspecified hand, sequela",icd10
369017469,1985-02-04 14:03:33,D229,"Melanocytic nevi, unspecified",icd10
268269894,1994-06-30 09:08:35,B5731,Megaesophagus in Chagas' disease,icd10
275853166,1987-10-28 15:24:14,S62512K,"Displaced fracture of proximal phalanx of left thumb, subsequent encounter for fracture with nonunion",icd10
353953649,1980-08-20 02:38:29,S52122D,"Displaced fracture of head of left radius, subsequent encounter for closed fracture with routine healing",icd10
252511003,1990-03-24 17:14:52,S14147A,"Brown-Sequard syndrome at C7 level of cervical spinal cord, initial encounter",icd10
363451711,2019-01-12 16:51:24,S31521D,"Laceration with foreign body of unspecified external genital organs, male, subsequent encounter",icd10
328825883,1992-06-07 23:19:28,S92505G,"Nondisplaced unspecified fracture of left lesser toe(s), subsequent encounter for fracture with delayed healing",icd10
217858230,2017-06-18 11:37:13,B3749,Other urogenital candidiasis,icd10
304343325,1978-11-16 08:02:41,S52362C,"Displaced segmental fracture of shaft of radius, left arm, initial encounter for open fracture type IIIA, IIIB, or IIIC",icd10
388940180,2014-01-20 22:43:13,S23130A,"Subluxation of T4/T5 thoracic vertebra, initial encounter",icd10
325393290,1993-11-04 13:35:48,S42122B,"Displaced fracture of acromial process, left shoulder, initial encounter for open fracture",icd10
311061644,1976-05-29 02:18:35,S24104A,"Unspecified injury at T11-T12 level of thoracic spinal cord, initial encounter",icd10
211624744,2008-06-23 16:15:43,T24291D,"Burn of second degree of multiple sites of right lower limb, except ankle and foot, subsequent encounter",icd10
296487973,1984-09-19 11:22:23,S62668G,"Nondisplaced fracture of distal phalanx of other finger, subsequent encounter for fracture with delayed healing",icd10
274921748,1976-12-16 22:30:01,Z0379,Encounter for other suspected maternal and fetal conditions ruled out,icd10
277802310,1977-07-25 20:17:16,Q782,Osteopetrosis,icd10
321559084,2002-10-04 09:19:57,T83118S,"Breakdown (mechanical) of other urinary devices and implants, sequela",icd10
388753634,1983-04-05 09:15:38,S32615K,"Nondisplaced avulsion fracture of left ischium, subsequent encounter for fracture with nonunion",icd10
227654536,2019-03-16 08:35:56,R091,Pleurisy,icd10
284780464,1993-02-17 23:31:28,O3412,"Maternal care for benign tumor of corpus uteri, second trimester",icd10
213469425,1977-09-28 14:51:49,O361130,"Maternal care for Anti-A sensitization, third trimester, not applicable or unspecified",icd10
334864601,1986-05-11 05:57:48,S61522S,"Laceration with foreign body of left wrist, sequela",icd10
349545323,1974-01-10 08:50:02,V0909XD,"Pedestrian injured in nontraffic accident involving other motor vehicles, subsequent encounter",icd10
331439370,2009-07-26 05:09:28,S89312P,"Salter-Harris Type I physeal fracture of lower end of left fibula, subsequent encounter for fracture with malunion",icd10
366952959,1994-03-26 06:44:47,T24109D,"Burn of first degree of unspecified site of unspecified lower limb, except ankle and foot, subsequent encounter",icd10
350958700,2009-08-27 04:58:08,S21011S,"Laceration without foreign body of right breast, sequela",icd10
258806614,1981-12-11 06:51:06,S55211A,"Laceration of vein at forearm level, right arm, initial encounter",icd10
361045327,2007-11-19 04:02:20,H4312,"Vitreous hemorrhage, left eye",icd10
350628972,1986-02-13 20:43:45,S55219S,"Laceration of vein at forearm level, unspecified arm, sequela",icd10
202706636,1990-08-26 14:06:03,T63111A,"Toxic effect of venom of gila monster, accidental (unintentional), initial encounter",icd10
226778917,1985-03-21 10:42:55,S32492S,"Other specified fracture of left acetabulum, sequela",icd10
303284728,2019-06-13 13:37:30,S83101D,"Unspecified subluxation of right knee, subsequent encounter",icd10
217495953,1984-01-11 02:17:22,O3622X3,"Maternal care for hydrops fetalis, second trimester, fetus 3",icd10
381585182,1972-07-10 18:55:04,G5743,"Lesion of medial popliteal nerve, bilateral lower limbs",icd10
323839523,2012-03-04 15:47:21,M67921,"Unspecified disorder of synovium and tendon, right upper arm",icd10
359401620,1996-03-12 12:14:11,M87219,"Osteonecrosis due to previous trauma, unspecified shoulder",icd10
210470247,1997-08-30 23:14:52,V9431XD,"Injury to rider of (inflatable) recreational watercraft being pulled behind other watercraft, subsequent encounter",icd10
316462035,2019-12-17 16:41:56,S82026S,"Nondisplaced longitudinal fracture of unspecified patella, sequela",icd10
276551136,1999-04-07 12:35:17,S12551S,"Other traumatic nondisplaced spondylolisthesis of sixth cervical vertebra, sequela",icd10
249787981,1982-04-16 16:34:47,P029,"Newborn affected by abnormality of membranes, unspecified",icd10
282407834,1989-10-15 15:26:48,Y36331D,"War operations involving flamethrower, civilian, subsequent encounter",icd10
216642734,2009-09-22 08:51:42,T394X2A,"Poisoning by antirheumatics, not elsewhere classified, intentional self-harm, initial encounter",icd10
247498581,2008-06-16 03:35:57,S82132Q,"Displaced fracture of medial condyle of left tibia, subsequent encounter for open fracture type I or II with malunion",icd10
370188143,1986-01-09 12:46:25,S82132S,"Displaced fracture of medial condyle of left tibia, sequela",icd10
330217598,1992-04-28 17:05:48,S62125G,"Nondisplaced fracture of lunate [semilunar], left wrist, subsequent encounter for fracture with delayed healing",icd10
259887917,1994-07-23 10:50:56,O1002,Pre-existing essential hypertension complicating childbirth,icd10
202730565,1986-06-15 01:40:28,S45819A,"Laceration of other specified blood vessels at shoulder and upper arm level, unspecified arm, initial encounter",icd10
325046716,1996-10-16 19:04:09,S12400A,"Unspecified displaced fracture of fifth cervical vertebra, initial encounter for closed fracture",icd10
270009416,2007-01-07 01:09:42,D2110,"Benign neoplasm of connective and other soft tissue of unspecified upper limb, including shoulder",icd10
