סוג קוד,תיאור הבחנה,קוד הבחנה,תאריך ביקור,תעודת זהות
245482900,2018-09-01 00:14:52,S42222B,"2-part displaced fracture of surgical neck of left humerus, initial encounter for open fracture",icd10
201753692,1984-08-28 19:54:39,Y35813S,"Legal intervention involving manhandling, suspect injured, sequela",icd10
214772803,1971-10-21 13:35:50,O368199,"Decreased fetal movements, unspecified trimester, other fetus",icd10
381039748,1986-08-21 15:03:17,T5891XS,"Toxic effect of carbon monoxide from unspecified source, accidental (unintentional), sequela",icd10
208969853,2014-02-18 21:44:32,S89099D,"Other physeal fracture of upper end of unspecified tibia, subsequent encounter for fracture with routine healing",icd10
312623791,1992-08-22 22:04:51,Y36200D,"War operations involving unspecified explosion and fragments, military personnel, subsequent encounter",icd10
214589440,2007-03-31 17:34:31,Z206,Contact with and (suspected) exposure to human immunodeficiency virus [HIV],icd10
202399213,1999-11-12 08:23:21,T510X4D,"Toxic effect of ethanol, undetermined, subsequent encounter",icd10
250270625,1979-04-11 07:38:41,V820XXD,"Occupant of streetcar injured in collision with motor vehicle in nontraffic accident, subsequent encounter",icd10
337134900,1986-09-25 23:42:45,S32008G,"Other fracture of unspecified lumbar vertebra, subsequent encounter for fracture with delayed healing",icd10
219638906,2011-03-22 18:20:30,S82856P,"Nondisplaced trimalleolar fracture of unspecified lower leg, subsequent encounter for closed fracture with malunion",icd10
293777576,1990-11-23 00:50:57,H16203,"Unspecified keratoconjunctivitis, bilateral",icd10
252795930,1993-06-09 07:20:32,T22539A,"Corrosion of first degree of unspecified upper arm, initial encounter",icd10
315495996,1979-12-10 06:40:19,S7223XR,"Displaced subtrochanteric fracture of unspecified femur, subsequent encounter for open fracture type IIIA, IIIB, or IIIC with malunion",icd10
353895155,2006-05-20 15:09:25,S60427A,"Blister (nonthermal) of left little finger, initial encounter",icd10
330071926,2000-07-05 00:49:10,T84099S,"Other mechanical complication of unspecified internal joint prosthesis, sequela",icd10
237900674,1973-06-11 18:16:34,S62308P,"Unspecified fracture of other metacarpal bone, subsequent encounter for fracture with malunion",icd10
334380945,1978-01-24 18:44:00,V9104XD,"Burn due to sailboat on fire, subsequent encounter",icd10
269764578,2011-01-18 22:50:41,T470X2A,"Poisoning by histamine H2-receptor blockers, intentional self-harm, initial encounter",icd10
358268846,1991-05-04 08:48:32,S31120S,"Laceration of abdominal wall with foreign body, right upper quadrant without penetration into peritoneal cavity, sequela",icd10
381859160,1997-02-05 11:34:53,S43119D,"Subluxation of unspecified acromioclavicular joint, subsequent encounter",icd10
256145428,1982-11-27 01:25:37,S92063B,"Displaced intraarticular fracture of unspecified calcaneus, initial encounter for open fracture",icd10
351567872,2006-03-21 15:55:43,E1139,Type 2 diabetes mellitus with other diabetic ophthalmic complication,icd10
240299842,2016-11-18 01:14:41,S85212S,"Laceration of peroneal artery, left leg, sequela",icd10
365792202,1972-03-18 02:03:01,T365X6A,"Underdosing of aminoglycosides, initial encounter",icd10
310088167,1995-03-16 20:24:54,C50929,Malignant neoplasm of unspecified site of unspecified male breast,icd10
355395138,1983-08-19 10:10:58,M70839,"Other soft tissue disorders related to use, overuse and pressure, unspecified forearm",icd10
372813363,1988-12-25 19:35:28,T85520D,"Displacement of bile duct prosthesis, subsequent encounter",icd10
360363323,1975-11-21 11:46:49,T438X6S,"Underdosing of other psychotropic drugs, sequela",icd10
369440305,1981-07-10 08:59:04,C021,Malignant neoplasm of border of tongue,icd10
202574478,2003-03-23 06:20:48,T632X4A,"Toxic effect of venom of scorpion, undetermined, initial encounter",icd10
210618667,2002-05-05 04:57:18,O132,"Gestational [pregnancy-induced] hypertension without significant proteinuria, second trimester",icd10
356420169,1993-10-14 09:41:50,K2931,Chronic superficial gastritis with bleeding,icd10
328340488,2008-01-26 14:00:45,S72099H,"Other fracture of head and neck of unspecified femur, subsequent encounter for open fracture type I or II with delayed healing",icd10
225357532,1986-05-08 07:40:06,T17800S,"Unspecified foreign body in other parts of respiratory tract causing asphyxiation, sequela",icd10
314795502,1990-01-31 02:53:29,S12551A,"Other traumatic nondisplaced spondylolisthesis of sixth cervical vertebra, initial encounter for closed fracture",icd10
271510208,2019-06-17 18:09:04,M86131,"Other acute osteomyelitis, right radius and ulna",icd10
249284776,2010-07-28 17:36:34,I82529,Chronic embolism and thrombosis of unspecified iliac vein,icd10
202331239,2017-02-14 20:57:00,S92146K,"Nondisplaced dome fracture of unspecified talus, subsequent encounter for fracture with nonunion",icd10
208181404,2014-12-10 14:46:32,K55012,Diffuse acute (reversible) ischemia of small intestine,icd10
335240306,1982-12-08 16:57:26,L410,Pityriasis lichenoides et varioliformis acuta,icd10
287105387,1985-08-01 02:49:36,S52502E,"Unspecified fracture of the lower end of left radius, subsequent encounter for open fracture type I or II with routine healing",icd10
285524654,1992-05-14 06:41:06,S91242S,"Puncture wound with foreign body of left great toe with damage to nail, sequela",icd10
357608415,2007-04-23 21:59:31,T23502A,"Corrosion of first degree of left hand, unspecified site, initial encounter",icd10
368321311,2020-04-03 03:54:56,T443X1S,"Poisoning by other parasympatholytics [anticholinergics and antimuscarinics] and spasmolytics, accidental (unintentional), sequela",icd10
357662862,2020-04-28 05:26:14,S42022B,"Displaced fracture of shaft of left clavicle, initial encounter for open fracture",icd10
358501809,2008-11-26 16:04:02,S76209S,"Unspecified injury of adductor muscle, fascia and tendon of unspecified thigh, sequela",icd10
330799390,1975-02-25 12:47:45,V00112A,"In-line roller-skater colliding with stationary object, initial encounter",icd10
240183999,1992-05-19 03:41:39,S83241D,"Other tear of medial meniscus, current injury, right knee, subsequent encounter",icd10
317359717,1978-04-10 22:10:10,Y36271S,"War operations involving fragments from weapons, civilian, sequela",icd10
251494411,1988-03-04 01:06:32,H26103,"Unspecified traumatic cataract, bilateral",icd10
370191134,1978-03-19 13:42:04,S61333A,"Puncture wound without foreign body of left middle finger with damage to nail, initial encounter",icd10
378198867,1989-12-17 03:09:49,Y37220S,"Military operations involving explosion of guided missile, military personnel, sequela",icd10
333532053,1975-07-10 01:30:35,T84031S,"Mechanical loosening of internal left hip prosthetic joint, sequela",icd10
297349305,2000-09-13 23:29:49,L97215,Non-pressure chronic ulcer of right calf with muscle involvement without evidence of necrosis,icd10
294839104,2017-02-25 15:50:47,E103542,"Type 1 diabetes mellitus with proliferative diabetic retinopathy with combined traction retinal detachment and rhegmatogenous retinal detachment, left eye",icd10
231020528,1987-04-24 06:05:22,S40869D,"Insect bite (nonvenomous) of unspecified upper arm, subsequent encounter",icd10
297909665,1987-06-16 00:28:55,T38814D,"Poisoning by anterior pituitary [adenohypophyseal] hormones, undetermined, subsequent encounter",icd10
236285925,1975-06-20 22:55:32,S82034N,"Nondisplaced transverse fracture of right patella, subsequent encounter for open fracture type IIIA, IIIB, or IIIC with nonunion",icd10
369869245,1996-12-22 01:02:41,M9917,Subluxation complex (vertebral) of upper extremity,icd10
330206466,1989-04-03 09:57:06,S99099D,"Other physeal fracture of unspecified calcaneus, subsequent encounter for fracture with routine healing",icd10
277843058,1997-07-28 21:24:24,L97303,Non-pressure chronic ulcer of unspecified ankle with necrosis of muscle,icd10
313141529,1988-08-10 21:56:49,V9220XD,"Drowning and submersion due to being washed overboard from merchant ship, subsequent encounter",icd10
338941412,1988-01-13 01:54:45,S82201F,"Unspecified fracture of shaft of right tibia, subsequent encounter for open fracture type IIIA, IIIB, or IIIC with routine healing",icd10
220325546,1990-10-28 06:31:46,W2104XD,"Struck by golf ball, subsequent encounter",icd10
322859829,2013-07-10 15:46:19,M85812,"Other specified disorders of bone density and structure, left shoulder",icd10
265990502,1980-09-02 11:32:19,F1097,"Alcohol use, unspecified with alcohol-induced persisting dementia",icd10
303979162,1999-05-25 13:44:54,T2147XA,"Corrosion of unspecified degree of female genital region, initial encounter",icd10
240817281,2016-12-04 21:28:48,S82136C,"Nondisplaced fracture of medial condyle of unspecified tibia, initial encounter for open fracture type IIIA, IIIB, or IIIC",icd10
336600197,1997-04-04 18:17:50,S32130K,"Nondisplaced Zone III fracture of sacrum, subsequent encounter for fracture with nonunion",icd10
361833519,2012-10-30 08:48:15,T375X2S,"Poisoning by antiviral drugs, intentional self-harm, sequela",icd10
315191811,1995-03-07 15:59:55,T421X2D,"Poisoning by iminostilbenes, intentional self-harm, subsequent encounter",icd10
366926892,1991-02-23 04:39:30,T17398A,"Other foreign object in larynx causing other injury, initial encounter",icd10
349528168,2006-12-21 22:17:55,T45603S,"Poisoning by unspecified fibrinolysis-affecting drugs, assault, sequela",icd10
246920730,2013-05-16 10:33:40,L03039,Cellulitis of unspecified toe,icd10
373299865,2001-07-25 23:40:06,S31824A,"Puncture wound with foreign body of left buttock, initial encounter",icd10
384421356,1996-01-28 13:15:11,H9211,"Otorrhea, right ear",icd10
275446425,1994-10-10 00:22:37,T63093D,"Toxic effect of venom of other snake, assault, subsequent encounter",icd10
231811622,1983-07-02 01:05:39,S59211D,"Salter-Harris Type I physeal fracture of lower end of radius, right arm, subsequent encounter for fracture with routine healing",icd10
256800838,2018-10-02 22:09:31,C089,"Malignant neoplasm of major salivary gland, unspecified",icd10
303668834,2018-03-05 23:45:01,M71132,"Other infective bursitis, left wrist",icd10
310661839,1995-04-20 07:21:39,S82223M,"Displaced transverse fracture of shaft of unspecified tibia, subsequent encounter for open fracture type I or II with nonunion",icd10
381910090,1971-10-09 17:03:25,S52609K,"Unspecified fracture of lower end of unspecified ulna, subsequent encounter for closed fracture with nonunion",icd10
371973382,1972-12-26 19:34:24,H16331,"Sclerosing keratitis, right eye",icd10
285271188,2015-04-25 22:20:51,D0760,Carcinoma in situ of unspecified male genital organs,icd10
328822890,2014-06-14 03:46:18,I87009,Postthrombotic syndrome without complications of unspecified extremity,icd10
378804183,1983-03-07 18:58:47,O10119,"Pre-existing hypertensive heart disease complicating pregnancy, unspecified trimester",icd10
209384855,1994-11-06 20:15:15,S91203A,"Unspecified open wound of unspecified great toe with damage to nail, initial encounter",icd10
336735131,1994-01-26 17:48:41,Z1619,Resistance to other specified beta lactam antibiotics,icd10
329395290,2011-07-05 11:32:22,X033XXS,"Fall due to controlled fire, not in building or structure, sequela",icd10
219814397,1998-05-13 08:21:39,H35112,"Retinopathy of prematurity, stage 0, left eye",icd10
262009550,2014-08-11 22:36:56,S46929D,"Laceration of unspecified muscle, fascia and tendon at shoulder and upper arm level, unspecified arm, subsequent encounter",icd10
345338547,2020-11-07 08:57:19,S93326S,"Dislocation of tarsometatarsal joint of unspecified foot, sequela",icd10
311292059,1997-03-05 11:08:14,H01019,"Ulcerative blepharitis unspecified eye, unspecified eyelid",icd10
210010807,2006-08-30 01:27:41,T655X1D,"Toxic effect of nitroglycerin and other nitric acids and esters, accidental (unintentional), subsequent encounter",icd10
212746522,2001-12-31 03:19:56,M24532,"Contracture, left wrist",icd10
367316331,2013-08-11 16:27:19,S56212S,"Strain of other flexor muscle, fascia and tendon at forearm level, left arm, sequela",icd10
304336177,1981-09-18 03:42:03,H4323,"Crystalline deposits in vitreous body, bilateral",icd10
361782534,2018-08-04 02:05:07,J671,Bagassosis,icd10
245475376,2003-08-09 00:38:34,K8520,Alcohol induced acute pancreatitis without necrosis or infection,icd10
344088308,1988-05-17 10:37:34,E11638,Type 2 diabetes mellitus with other oral complications,icd10
371640291,1985-04-15 03:03:55,M5124,"Other intervertebral disc displacement, thoracic region",icd10
354366688,1981-08-09 16:33:11,D7881,Other intraoperative complications of the spleen,icd10
378585471,2005-10-15 22:48:21,M25229,"Flail joint, unspecified elbow",icd10
210431528,1990-01-28 18:54:22,M25152,"Fistula, left hip",icd10
377958344,1998-03-04 09:27:09,S4991XA,"Unspecified injury of right shoulder and upper arm, initial encounter",icd10
212764751,2008-08-28 02:26:59,L538,Other specified erythematous conditions,icd10
377228490,1971-07-16 09:28:28,Q810,Epidermolysis bullosa simplex,icd10
259092437,1998-12-14 07:32:38,N070,"Hereditary nephropathy, not elsewhere classified with minor glomerular abnormality",icd10
345613055,1988-12-11 05:00:35,J0300,"Acute streptococcal tonsillitis, unspecified",icd10
243274273,1996-10-19 22:47:33,G451,Carotid artery syndrome (hemispheric),icd10
296811672,2019-07-12 02:57:59,M86562,"Other chronic hematogenous osteomyelitis, left tibia and fibula",icd10
371476464,2008-02-17 08:56:28,S71142S,"Puncture wound with foreign body, left thigh, sequela",icd10
286782966,1998-06-17 15:44:59,H20029,"Recurrent acute iridocyclitis, unspecified eye",icd10
206656320,2002-09-10 21:21:24,M65121,"Other infective (teno)synovitis, right elbow",icd10
202067497,2012-07-11 21:37:19,Z87411,Personal history of vaginal dysplasia,icd10
312568265,1989-01-11 09:17:00,Y389X2D,"Terrorism, secondary effects, civilian injured, subsequent encounter",icd10
225553158,1974-05-27 08:16:31,I70692,"Other atherosclerosis of nonbiological bypass graft(s) of the extremities, left leg",icd10
240428174,1994-08-06 12:35:19,S20319S,"Abrasion of unspecified front wall of thorax, sequela",icd10
294554579,1975-03-09 13:53:30,S73033S,"Other anterior subluxation of unspecified hip, sequela",icd10
267223696,1984-05-13 12:47:20,M05312,Rheumatoid heart disease with rheumatoid arthritis of left shoulder,icd10
203320234,1974-03-01 18:10:18,M1A4191,"Other secondary chronic gout, unspecified shoulder, with tophus (tophi)",icd10
211850692,1997-08-19 23:25:32,T38801A,"Poisoning by unspecified hormones and synthetic substitutes, accidental (unintentional), initial encounter",icd10
346421568,1974-09-26 11:50:06,S51812S,"Laceration without foreign body of left forearm, sequela",icd10
365457647,1995-07-07 16:51:09,S52399N,"Other fracture of shaft of radius, unspecified arm, subsequent encounter for open fracture type IIIA, IIIB, or IIIC with nonunion",icd10
247314239,1980-08-11 19:18:21,V515XXD,"Driver of pick-up truck or van injured in collision with pedal cycle in traffic accident, subsequent encounter",icd10
327647344,1993-03-03 08:39:02,M2655,Centric occlusion maximum intercuspation discrepancy,icd10
238197118,1997-08-10 11:58:33,V2919XD,"Motorcycle passenger injured in collision with other motor vehicles in nontraffic accident, subsequent encounter",icd10
331093707,1995-05-02 15:38:05,S72444B,"Nondisplaced fracture of lower epiphysis (separation) of right femur, initial encounter for open fracture type I or II",icd10
320140022,1972-06-26 23:18:26,V879XXS,"Person injured in other specified (collision)(noncollision) transport accidents involving nonmotor vehicle (traffic), sequela",icd10
208419001,1985-11-14 12:07:02,M19071,"Primary osteoarthritis, right ankle and foot",icd10
224487540,1972-08-04 01:44:01,T22512A,"Corrosion of first degree of left forearm, initial encounter",icd10
309449507,1990-12-27 12:01:28,T25291A,"Burn of second degree of multiple sites of right ankle and foot, initial encounter",icd10
264668570,1971-11-05 21:28:43,T446X3A,"Poisoning by alpha-adrenoreceptor antagonists, assault, initial encounter",icd10
315088642,1973-02-13 00:31:03,S96801D,"Unspecified injury of other specified muscles and tendons at ankle and foot level, right foot, subsequent encounter",icd10
381865379,1987-11-22 19:56:42,T8089XS,"Other complications following infusion, transfusion and therapeutic injection, sequela",icd10
354814337,1987-07-06 07:26:43,S52541E,"Smith's fracture of right radius, subsequent encounter for open fracture type I or II with routine healing",icd10
308987538,1992-01-17 13:36:32,T420X4D,"Poisoning by hydantoin derivatives, undetermined, subsequent encounter",icd10
218010815,2016-03-19 22:38:19,S82443J,"Displaced spiral fracture of shaft of unspecified fibula, subsequent encounter for open fracture type IIIA, IIIB, or IIIC with delayed healing",icd10
339933382,1980-10-10 19:08:04,W5659XA,"Other contact with other fish, initial encounter",icd10
373810274,1990-08-04 18:39:34,G40B19,"Juvenile myoclonic epilepsy, intractable, without status epilepticus",icd10
381574189,2015-08-27 10:50:59,S63410A,"Traumatic rupture of collateral ligament of right index finger at metacarpophalangeal and interphalangeal joint, initial encounter",icd10
321656722,2011-01-18 05:22:36,O642XX5,"Obstructed labor due to face presentation, fetus 5",icd10
217794970,1974-07-27 17:10:11,C4091,Malignant neoplasm of unspecified bones and articular cartilage of right limb,icd10
345786308,1973-07-12 23:50:17,S01422A,"Laceration with foreign body of left cheek and temporomandibular area, initial encounter",icd10
307563205,1986-10-22 16:07:05,W16812S,"Jumping or diving into other water striking water surface causing other injury, sequela",icd10
281848327,1987-06-24 16:49:56,Z89029,Acquired absence of unspecified finger(s),icd10
217714129,2012-01-25 01:53:06,S63218S,"Subluxation of metacarpophalangeal joint of other finger, sequela",icd10
229516028,1973-04-09 22:27:17,S42014A,"Posterior displaced fracture of sternal end of right clavicle, initial encounter for closed fracture",icd10
277986033,1985-05-16 09:41:42,S24152A,"Other incomplete lesion at T2-T6 level of thoracic spinal cord, initial encounter",icd10
291348336,1984-10-17 10:36:08,S72122F,"Displaced fracture of lesser trochanter of left femur, subsequent encounter for open fracture type IIIA, IIIB, or IIIC with routine healing",icd10
288341600,2009-03-27 06:14:04,T24402A,"Corrosion of unspecified degree of unspecified site of left lower limb, except ankle and foot, initial encounter",icd10
373527936,2018-06-27 01:45:14,Z20828,Contact with and (suspected) exposure to other viral communicable diseases,icd10
237485938,2020-07-10 05:59:51,H3092,"Unspecified chorioretinal inflammation, left eye",icd10
236961842,2002-08-17 04:19:23,S31021D,"Laceration with foreign body of lower back and pelvis with penetration into retroperitoneum, subsequent encounter",icd10
243239668,2019-06-02 01:12:59,M8540,"Solitary bone cyst, unspecified site",icd10
308274899,1971-08-31 16:27:04,C099,"Malignant neoplasm of tonsil, unspecified",icd10
276460546,1994-03-06 16:27:39,L7682,Other postprocedural complications of skin and subcutaneous tissue,icd10
249807405,2002-12-28 23:26:54,T621X2D,"Toxic effect of ingested berries, intentional self-harm, subsequent encounter",icd10
356896793,1995-05-10 15:49:47,D7889,Other postprocedural complications of the spleen,icd10
228616144,1977-11-20 15:26:30,S72042P,"Displaced fracture of base of neck of left femur, subsequent encounter for closed fracture with malunion",icd10
318764421,2003-05-25 17:01:04,C8523,"Mediastinal (thymic) large B-cell lymphoma, intra-abdominal lymph nodes",icd10
218792149,1984-05-22 02:14:52,S42463K,"Displaced fracture of medial condyle of unspecified humerus, subsequent encounter for fracture with nonunion",icd10
227726353,1973-02-04 14:52:20,J930,Spontaneous tension pneumothorax,icd10
308522973,1995-07-21 18:54:58,V00188D,"Other accident on other rolling-type pedestrian conveyance, subsequent encounter",icd10
389291364,2015-12-16 09:15:59,N6049,Mammary duct ectasia of unspecified breast,icd10
229032484,1994-09-01 19:51:35,S06819A,"Injury of right internal carotid artery, intracranial portion, not elsewhere classified with loss of consciousness of unspecified duration, initial encounter",icd10
370755587,1991-06-03 10:30:24,Q979,"Sex chromosome abnormality, female phenotype, unspecified",icd10
262256444,2000-09-02 11:36:32,O2432,Unspecified pre-existing diabetes mellitus in childbirth,icd10
250049406,2005-07-09 02:26:27,S02112S,"Type III occipital condyle fracture, unspecified side, sequela",icd10
354404037,2012-06-28 03:01:24,S56319D,"Strain of extensor or abductor muscles, fascia and tendons of unspecified thumb at forearm level, subsequent encounter",icd10
327922851,2014-01-26 01:04:08,T33811A,"Superficial frostbite of right ankle, initial encounter",icd10
335267436,2006-06-17 11:43:38,T34839A,"Frostbite with tissue necrosis of unspecified toe(s), initial encounter",icd10
220907558,2015-01-17 07:13:30,S0452XD,"Injury of facial nerve, left side, subsequent encounter",icd10
244374612,1982-01-11 01:07:47,I519,"Heart disease, unspecified",icd10
295681589,2020-08-21 00:54:20,S27401D,"Unspecified injury of bronchus, unilateral, subsequent encounter",icd10
265317438,2004-01-29 02:04:00,H9212,"Otorrhea, left ear",icd10
362753517,2005-05-20 03:27:49,Q7163,"Lobster-claw hand, bilateral",icd10
333804956,1973-09-11 15:28:46,M85049,"Fibrous dysplasia (monostotic), unspecified hand",icd10
331029074,1992-03-03 15:53:47,M2619,Other specified anomalies of jaw-cranial base relationship,icd10
346067329,2000-01-12 05:54:54,S93304A,"Unspecified dislocation of right foot, initial encounter",icd10
276891057,2019-10-18 19:37:33,X100XXA,"Contact with hot drinks, initial encounter",icd10
201004505,2007-10-11 12:57:40,S032XXS,"Dislocation of tooth, sequela",icd10
358671355,1982-12-10 13:22:41,M60071,"Infective myositis, left ankle",icd10
298810158,1993-04-08 08:18:56,I63113,Cerebral infarction due to embolism of bilateral vertebral arteries,icd10
370619098,2012-09-13 20:28:03,S2750XS,"Unspecified injury of thoracic trachea, sequela",icd10
308019479,2003-06-24 14:26:24,S99242A,"Salter-Harris Type IV physeal fracture of phalanx of left toe, initial encounter for closed fracture",icd10
205920647,1980-04-16 02:46:36,M8468XK,"Pathological fracture in other disease, other site, subsequent encounter for fracture with nonunion",icd10
245352122,1994-01-08 22:58:50,M80812S,"Other osteoporosis with current pathological fracture, left shoulder, sequela",icd10
233185914,2018-10-24 14:26:53,S72136F,"Nondisplaced apophyseal fracture of unspecified femur, subsequent encounter for open fracture type IIIA, IIIB, or IIIC with routine healing",icd10
384863897,1980-01-18 07:31:17,S43311A,"Subluxation of right scapula, initial encounter",icd10
347881160,1995-08-18 05:18:54,S66021A,"Laceration of long flexor muscle, fascia and tendon of right thumb at wrist and hand level, initial encounter",icd10
263260143,2014-06-04 02:00:17,S72301P,"Unspecified fracture of shaft of right femur, subsequent encounter for closed fracture with malunion",icd10
348163297,2009-04-08 05:04:00,H50412,"Cyclotropia, left eye",icd10
345317561,1995-11-04 21:17:35,I25731,Atherosclerosis of nonautologous biological coronary artery bypass graft(s) with angina pectoris with documented spasm,icd10
318358198,2008-06-20 01:10:58,S82422H,"Displaced transverse fracture of shaft of left fibula, subsequent encounter for open fracture type I or II with delayed healing",icd10
389693950,2005-10-18 16:17:59,T22799S,"Corrosion of third degree of multiple sites of unspecified shoulder and upper limb, except wrist and hand, sequela",icd10
206765175,2014-12-31 14:05:50,S95299D,"Other specified injury of dorsal vein of unspecified foot, subsequent encounter",icd10
279860191,1978-07-13 16:12:16,G528,Disorders of other specified cranial nerves,icd10
316986973,1988-05-12 09:18:08,V8612XD,"Passenger of snowmobile injured in traffic accident, subsequent encounter",icd10
289368241,2017-06-13 16:15:42,T6482XA,"Toxic effect of other mycotoxin food contaminants, intentional self-harm, initial encounter",icd10
335436332,1989-09-24 02:34:26,T85511A,"Breakdown (mechanical) of esophageal anti-reflux device, initial encounter",icd10
354095308,2016-10-13 17:52:22,H15842,"Scleral ectasia, left eye",icd10
302241737,1997-12-24 12:29:27,L03321,Acute lymphangitis of abdominal wall,icd10
289849987,2010-09-05 18:40:27,W16821A,"Jumping or diving into other water striking bottom causing drowning and submersion, initial encounter",icd10
328716282,1995-03-13 02:21:41,S02109D,"Fracture of base of skull, unspecified side, subsequent encounter for fracture with routine healing",icd10
370695335,2008-10-31 12:26:40,S56403D,"Unspecified injury of extensor muscle, fascia and tendon of right middle finger at forearm level, subsequent encounter",icd10
258166913,1982-04-25 01:41:11,S12301G,"Unspecified nondisplaced fracture of fourth cervical vertebra, subsequent encounter for fracture with delayed healing",icd10
265546538,1997-02-28 05:24:02,M84379S,"Stress fracture, unspecified toe(s), sequela",icd10
200184343,2008-02-25 02:23:33,H3091,"Unspecified chorioretinal inflammation, right eye",icd10
282004416,2003-02-22 19:38:40,O29029,"Pressure collapse of lung due to anesthesia during pregnancy, unspecified trimester",icd10
205125416,2019-12-10 22:02:27,S92901G,"Unspecified fracture of right foot, subsequent encounter for fracture with delayed healing",icd10
204693431,1973-09-13 05:08:08,S92242P,"Displaced fracture of medial cuneiform of left foot, subsequent encounter for fracture with malunion",icd10
230637892,1988-04-04 11:10:54,T445X4S,"Poisoning by predominantly beta-adrenoreceptor agonists, undetermined, sequela",icd10
